{
  "code": "TR",
  "iso_n3": "792",
  "flag": "🇹🇷",
  "framework": "KVKK",
  "year": 2016,
  "lastUpdated": "2026-05-19",
  "summary": {
    "tr": {
      "name": "Türkiye",
      "lawTitle": "6698 Sayılı Kişisel Verilerin Korunması Kanunu",
      "regulator": "Kişisel Verileri Koruma Kurumu (KVK Kurumu)",
      "regulatorUrl": "https://www.kvkk.gov.tr",
      "summary": "Türkiye'nin temel kişisel veri rejimi; 7 Nisan 2016'da yürürlüğe giren 6698 sayılı Kanun, 12 Mart 2024'te kabul edilen 7499 sayılı Kanun ile GDPR'a yakınsayan ilk büyük revizyonu yaşadı. Bu revizyon (1) özel nitelikli veriler için yeni hukuki sebepler tanıdı, (2) yurt dışı aktarımı yeterlilik kararı/uygun güvence/arızi haller silsilesine taşıdı, (3) standart sözleşme bildirim yükümlülüğünü getirdi. Sistemin pratik yükü ise hâlâ VERBİS kaydı ve veri sorumlusu yükümlülükleri etrafında yoğunlaşıyor.",
      "rights": ["Bilgi talep etme","Erişim","Düzeltme","Silme/yok etme","Aktarım bildirimini isteme","İtiraz","Zararın giderilmesini talep"],
      "bases": ["Açık rıza","Kanunda açıkça öngörülmesi","Sözleşmenin kurulması/ifası","Hukuki yükümlülük","Aleniyet","Hak tesisi/koruma","Meşru menfaat"],
      "maxFine": "1 Ocak 2026 itibarıyla en yüksek tek başlık 17.092.242 TL (Md. 18). 2025 yılında veri güvenliği ihlali ve Kurul kararına uymama için üst sınır 13.620.402 TL idi.",
      "extraterritorial": "Türkiye'de yerleşik veri sahiplerini hedefleyen yurt dışı veri sorumlularını da kapsar; Kurul, sınır ötesi platformları (Meta, WhatsApp, TikTok, Clearview) VERBİS yükümlülüğü çerçevesinde sıkça yaptırıma tabi tutmuştur.",
      "notable": "Meta/WhatsApp VERBİS (2,67'şer M TL, 2024); TikTok 1,75 M TL (2023); KVKK 2024 toplam ceza hacmi 552,7 M TL."
    },
    "en": {
      "name": "Türkiye",
      "lawTitle": "Law No. 6698 on the Protection of Personal Data",
      "regulator": "Personal Data Protection Authority (KVK Kurumu)",
      "regulatorUrl": "https://www.kvkk.gov.tr",
      "summary": "Türkiye's foundational personal-data regime, in force since 7 April 2016. Law No. 7499 of 12 March 2024 introduced the first substantial overhaul: (i) it broadened the lawful bases for processing special-category data, (ii) replaced the prior Board-permission gate for international transfers with a tiered adequacy / appropriate-safeguards / occasional-grounds cascade, and (iii) introduced a 5-business-day notification duty for Standard Contractual Clauses. In day-to-day enforcement the regime still pivots around the VERBİS data-controllers registry.",
      "rights": ["Information","Access","Rectification","Erasure / destruction","Onward-transfer notification","Object","Compensation for damages"],
      "bases": ["Explicit consent","Expressly provided by law","Necessity for a contract","Legal obligation","Publicly disclosed","Establishment / defence of legal rights","Legitimate interests"],
      "maxFine": "As of 1 January 2026 the highest single-head ceiling is TRY 17,092,242 (Art. 18). The 2025 ceiling for data-security failures and non-compliance with Board decisions was TRY 13,620,402.",
      "extraterritorial": "Reaches non-Turkish controllers targeting data subjects in Türkiye; the Board has repeatedly fined cross-border platforms (Meta, WhatsApp, TikTok, Clearview) for failure to enroll in VERBİS.",
      "notable": "Meta/WhatsApp VERBİS (TRY 2.67M each, 2024); TikTok TRY 1.75M (2023); aggregate 2024 fine volume TRY 552.7M."
    }
  },
  "details": {
    "tr": {
      "overview": "6698 sayılı KVKK, AB'nin 95/46/EC Direktifi'nden esinlenerek 7 Nisan 2016'da yürürlüğe girdi[^kvkk-resmi]. Anayasa'nın 20/3 maddesindeki kişisel verilerin korunmasını isteme hakkını uygulayan organik kanundur. Kişisel Verileri Koruma Kurumu (Kurum), 9 üyeli Kişisel Verileri Koruma Kurulu (Kurul) tarafından yönetilen idari yapıdır; başkanlığını Prof. Dr. Faruk Bilir yürütmektedir. Mart 2024'te 7499 sayılı Kanun ile yapılan değişiklikler, KVKK'nın AB Genel Veri Koruma Tüzüğü ile uyumlulaştırılması yolundaki ilk büyük adımdır[^mondaq-2024-amend].",
      "materialScope": "Kanun, gerçek kişilere ait verilerin tamamen veya kısmen otomatik yollarla ya da herhangi bir veri kayıt sisteminin parçası olarak otomatik olmayan yollarla işlenmesine uygulanır (Md. 2). Anonim hâle getirilmiş veriler kapsam dışındadır; tüzel kişi verileri Kanun'un koruma alanı dışındadır.",
      "territorialScope": "Kanun, Türkiye'de yerleşik veri sorumlularının yanı sıra, Türkiye'deki ilgili kişileri hedef alan yurt dışı yerleşik veri sorumlularını da kapsar (Md. 2). Kurul, Meta, WhatsApp ve TikTok gibi sınır ötesi platformlara karşı yetkisini bu temel üzerinden kurmuştur[^gun-meta].",
      "definitions": "Kişisel veri: kimliği belirli veya belirlenebilir gerçek kişiye ilişkin her türlü bilgi (Md. 3/1-d). Özel nitelikli veri: ırk, etnik köken, siyasi düşünce, felsefi inanç, din, mezhep veya diğer inançlar, kılık ve kıyafet, dernek/vakıf/sendika üyeliği, sağlık, cinsel hayat, ceza mahkûmiyeti ve güvenlik tedbirleri, biyometrik ve genetik veriler (Md. 6/1). Veri sorumlusu: kişisel verilerin işleme amaç ve vasıtalarını belirleyen, veri kayıt sisteminin kurulması ve yönetilmesinden sorumlu gerçek/tüzel kişi (Md. 3/1-ı).",
      "lawfulBases": "Md. 5/2 yedi hukuki sebep sayar: (1) kanunda açıkça öngörülme, (2) fiili imkânsızlık nedeniyle rıza alınamayan kişinin hayatı/beden bütünlüğünün korunması, (3) sözleşmenin kurulması/ifası için zorunluluk, (4) veri sorumlusunun hukuki yükümlülüğünü yerine getirmesi, (5) ilgili kişinin kendisi tarafından alenileştirilmesi, (6) hak tesisi/kullanımı/korunması, (7) meşru menfaat dengesi. Bu sebeplerden biri yoksa açık rıza esastır. 7499 sayılı Kanun, özel nitelikli verilerin işlenmesinde açık rıza dışındaki sebepleri genişletti: artık tüm özel nitelikli veri kategorileri için meşru menfaat hariç beş yeni hukuki sebep mevcuttur (Md. 6/3, değişiklik sonrası)[^canpolat-2024].",
      "rightsLong": "Md. 11 kapsamında ilgili kişi: işlenip işlenmediğini öğrenme, işlenmişse bilgi talep etme, amacını ve amacına uygun kullanılıp kullanılmadığını öğrenme, aktarıldığı üçüncü kişileri bilme, eksik/yanlış işlenmesi halinde düzeltilmesini isteme, Md. 7'deki şartlar çerçevesinde silinmesini/yok edilmesini isteme, bu işlemlerin aktarıldığı üçüncü kişilere bildirilmesini isteme, sadece otomatik sistemler vasıtasıyla analiz edilmek suretiyle aleyhine sonuç doğmasına itiraz etme ve zarara uğraması hâlinde zararın giderilmesini talep etme haklarına sahiptir. Başvuru süresi: veri sorumlusu 30 gün içinde cevap vermek zorundadır (Md. 13/2).",
      "obligations": "VERBİS kaydı (Veri Sorumluları Sicil Bilgi Sistemi) yıllık çalışan sayısı > 50 veya yıllık mali bilanço > 100 M TL olan veri sorumluları için zorunludur; muafiyet kategorileri Kurul kararı 2018/87 ile belirlenmiştir. Türkiye'de yerleşik olmayan veri sorumluları için sayısal eşik aranmaksızın VERBİS kaydı şarttır; Meta/WhatsApp cezaları bu yükümlülüğe dayanır[^gun-meta]. DPO atama zorunluluğu yoktur — yerine \"irtibat kişisi\" görevlendirmesi öngörülmüştür. DPIA (Etki Değerlendirmesi) genel olarak zorunlu değil ama Kurul rehberleri yüksek riskli işlemeler için önerir.",
      "crossBorder": "1 Haziran 2024'ten itibaren yurt dışı aktarım üç kademelidir (Md. 9, değişiklik sonrası)[^paksoy-2024]: (1) **Yeterlilik kararı** — Kurul'un ilan ettiği güvenli ülke/sektör/uluslararası kuruluş bulunmamaktadır (Mayıs 2026 itibarıyla hiçbir ülke yeterli ilan edilmemiştir); (2) **Uygun güvenceler** — taraflar arasında imzalanan ve Kurum'a 5 iş günü içinde bildirilen Standart Sözleşmeler (Kurum'un yayımladığı 4 modül: veri sorumlusu–veri sorumlusu, veri sorumlusu–veri işleyen, vb.), Bağlayıcı Şirket Kuralları (Kurul onayı şart), uluslararası protokoller; (3) **Arızi haller** — Md. 9/6: açık rıza, sözleşme ifası, kamu yararı, hayati menfaat, hak tesisi, kamu sicili. Standart sözleşme bildirim yükümlülüğüne aykırılık 50.000–1.000.000 TL idari para cezasıyla karşılanır[^cottgroup-fines]. Geçiş döneminde 1 Eylül 2024'e kadar eski rejim (Kurul izni) işletildi.",
      "breachNotification": "Md. 12/5: veri sorumlusu, ihlali en kısa sürede ve her hâlde 72 saat içinde Kurul'a, ilgili kişilere makul olduğu kadar kısa sürede bildirmekle yükümlüdür. Kurul, 2019/10 sayılı kararı ile bildirim formunu ve süre hesabını detaylandırmıştır; \"makul sürede\" ifadesi uygulamada \"ihlalden haberdar olunduğu andan itibaren 72 saat\" olarak yorumlanır. İhlal bildirim ihmali, veri güvenliği başlığı altında 2026 itibarıyla 204.285 TL–17.092.242 TL aralığında cezalandırılır.",
      "enforcement": "2025 yılı sınırları (yeniden değerleme öncesi)[^cottgroup-fines]: aydınlatma 68.083–1.362.021 TL; veri güvenliği 204.285–13.620.402 TL; Kurul kararına uymama 340.476–13.620.402 TL; VERBİS 272.380–13.620.402 TL. 2026 için %43,93 yeniden değerleme uygulandı; en yüksek tek başlık 17.092.242 TL'ye yükseldi. 2024 yıl sonu itibarıyla Kurul toplam 552,7 M TL ceza uygulamış[^kvkk-2024-rapor]; 2025'in ilk 11 ayında 352 M TL'yi aşmıştır. Öne çıkan kararlar: Meta + WhatsApp 2,67'şer M TL (2024, VERBİS); TikTok 1,75 M TL (2023, aydınlatma/açık rıza); Amazon 1,2 M TL (2020); Yapı Kredi 1,46 M TL (2023, veri ihlali); Clearview AI 1,45 M TL (2023, biyometrik).",